title,provider,award,ects_credits,mode,deadline,start_date,end_date,nfq,ote_flag,skill_area,link
Bachelor of Science in Pharmaceutical Technology April 2019,"Institute of Technology, Tallaght",Bachelor of Science in Pharmaceutical Technology,65,Part Time,10/5/2019,17/6/2019,30/6/2020,7,Yes,"['natural', 'sciences', 'mathematics', 'statistics']",https://springboardcourses.ie/details/6576
Certificate in Food and Beverage Operations [Consortium],Letterkenny Institute of Technology,minor,70,Part Time,5/4/2019,8/4/2019,21/6/2019,6,Yes,['services'],https://springboardcourses.ie/details/6575
ACCA Diploma in Accounting and Business March 2019,Professional Accountancy Training,ACCA Diploma in Accounting and Business,45,Part Time,22/3/2019,27/3/2019,31/3/2020,6,Yes,"['business', 'administration', 'law']",https://springboardcourses.ie/details/6574
Certificate in Data Protection - WICKLOW CAMPUS(March 2019),"Institute of Technology, Carlow",NFQ Level 8 (10 credit module),10,Part Time,7/3/2019,8/3/2019,22/3/2019,8,Yes,['services'],https://springboardcourses.ie/details/6570
Certificate in Data Protection (March 2019),"Institute of Technology, Carlow",NFQ Level 8 (10 credit module),10,Part Time,20/3/2019,27/3/2019,10/4/2019,8,Yes,['services'],https://springboardcourses.ie/details/6568
"Postgraduate Certificate in Creative Thinking, Innovation & Entrepreneurship (Returners - March 2019)",Trinity College Dublin,"Postgraduate Certificate in Creative Thinking, Innovation and Entrepreneurship",30,Part Time,15/3/2019,27/3/2019,9/8/2019,9,Yes,"['business', 'administration', 'law']",https://springboardcourses.ie/details/6565
Entrepreneurs Programme leading to an Advanced Certificate in Management Practice (March 2019),Irish Times Training,Advanced Certificate in Management Practice ,30,Part Time,21/3/2019,28/3/2019,1/8/2019,6,Yes,"['business', 'administration', 'law']",https://springboardcourses.ie/details/6561
Postgraduate Certificate in Innovation and Enterprise Development (Cork),Trinity College Dublin,Postgraduate Certificate,30,Part Time,14/3/2019,25/3/2019,9/8/2019,9,Yes,"['business', 'administration', 'law']",https://springboardcourses.ie/details/6557
Postgraduate Certificate in Innovation and Enterprise Development (Galway),Trinity College Dublin,Postgraduate Certificate,30,Part Time,22/3/2019,25/3/2019,9/8/2019,9,Yes,"['business', 'administration', 'law']",https://springboardcourses.ie/details/6556
Postgraduate Certificate in Innovation and Enterprise Development (Limerick),Trinity College Dublin,Postgraduate Certificate,30,Part Time,15/3/2019,25/3/2019,9/8/2019,9,Yes,"['business', 'administration', 'law']",https://springboardcourses.ie/details/6555
Level 7 Degree in Pharmaceutical Business Operations [March  2019] [Dublin],Innopharma College of Applied Sciences,Level 7 in Pharmaceutical Business Operations,60,Part Time,27/3/2019,27/3/2019,10/1/2020,7,Yes,"['engineering', 'manufacturing', 'construction']",https://springboardcourses.ie/details/6553
Level 7 Degree in Pharmaceutical Business Operations [March  2019] [Cork],Innopharma College of Applied Sciences,Level 7 in Pharmaceutical Business Operations,60,Part Time,29/3/2019,29/3/2019,10/1/2020,7,Yes,"['engineering', 'manufacturing', 'construction']",https://springboardcourses.ie/details/6551
"Certificate in Purchasing Strategy, Quality Management and Lean Six Sigma (Dublin)","Institute of Technology, Carlow",NFQ Level 6 (60 credits),60,Part Time,24/1/2019,4/2/2019,30/5/2019,6,Yes,"['engineering', 'manufacturing', 'construction']",https://springboardcourses.ie/details/6546
"Certificate in Operations, Quality and Lean Management (Tullamore - January 2019)",Athlone Institute of Technology,"Certificate in Operations, Quality and Lean Management",60,Part Time,5/2/2019,6/2/2019,20/12/2019,6,Yes,"['natural', 'sciences', 'mathematics', 'statistics']",https://springboardcourses.ie/details/6543
"Certificate in Operations, Quality and Lean Management (Athlone - January 2019)",Athlone Institute of Technology,"Certificate in Operations, Quality and Lean Management",60,Part Time,31/1/2019,31/1/2019,20/12/2019,6,Yes,"['natural', 'sciences', 'mathematics', 'statistics']",https://springboardcourses.ie/details/6541
PRACTICAL ENTREPRENEURSHIP- Learn to work for yourself FEB 2019,The Entrepreneurs Academy,QQI Level 6 Business Planning,15,Part Time,23/2/2019,23/2/2019,15/6/2019,6,Yes,"['business', 'administration', 'law']",https://springboardcourses.ie/details/6539
SPA Construction Management,Athlone Institute of Technology,Certificate - Special Purpose Award,40,Part Time,18/1/2019,25/1/2019,20/12/2019,8,Yes,"['engineering', 'manufacturing', 'construction']",https://springboardcourses.ie/details/6538
Higher Diploma in Food Science and Technology [January 2019] [Cork],Innopharma College of Applied Sciences,Level 8 Higher Diploma QQI,70,Part Time,30/1/2019,30/1/2019,10/1/2020,8,Yes,"['engineering', 'manufacturing', 'construction']",https://springboardcourses.ie/details/6535
Certificate in Aircraft Acquisition & Finance (Special Purpose) [March 2019],"Institute of Technology, Carlow",NFQ Level 7 - 10 credit module,10,Part Time,1/3/2019,8/3/2019,30/3/2019,7,Yes,"['engineering', 'manufacturing', 'construction']",https://springboardcourses.ie/details/6530
Certificate in Pharmaceutical and Medical Device Operations - Limerick/Online [January 2019],Innopharma College of Applied Sciences,Level 6 Minor Award QQI,70,Part Time,6/2/2019,6/2/2019,23/8/2019,6,Yes,"['engineering', 'manufacturing', 'construction']",https://springboardcourses.ie/details/6528
Diploma in Pharmaceutical and Medical Device Manufacturing [January 2019] [Dublin],Innopharma College of Applied Sciences,Level 8 Higher Diploma Award QQI,70,Part Time,21/1/2019,2/2/2019,31/1/2020,8,Yes,"['engineering', 'manufacturing', 'construction']",https://springboardcourses.ie/details/6524
MSc in Food Business Management and Technology [January 2019],Innopharma College of Applied Sciences,MSc in Food Business Management and Technology ,90,Part Time,31/1/2019,2/2/2019,10/1/2020,9,Yes,"['engineering', 'manufacturing', 'construction']",https://springboardcourses.ie/details/6522
Certificate in Data Protection (Feb 2019),"Institute of Technology, Carlow",NFQ Level 8 (10 credit module),10,Part Time,3/2/2019,6/2/2019,20/2/2019,8,Yes,['services'],https://springboardcourses.ie/details/6521
Building Information Modelling (BIM) - with Revit MEP,Limerick Institute of Technology,"Special Purpose Award (Level 6, 10 Credits)",10,Part Time,28/1/2019,29/1/2019,2/4/2019,6,Yes,"['engineering', 'manufacturing', 'construction']",https://springboardcourses.ie/details/6517
BA (Hons) Hotel Management,"Institute of Technology, Tralee",Minor,60,Part Time,4/1/2019,21/1/2019,20/12/2019,8,Yes,['services'],https://springboardcourses.ie/details/6508
Supply Chain Management  (Specialist Diploma) (Online) [January 2019],University of Limerick,Minor,36,Part Time,17/1/2019,21/1/2019,21/12/2019,9,Yes,"['engineering', 'manufacturing', 'construction']",https://springboardcourses.ie/details/6504
Higher Diploma in Science in Data Analytics - ONLINE - [2 Years Part-time] [January 2019] ,National College of Ireland,Higher Diploma in Science in Data Analytics - Major Award from Quality Qualifications Ireland,60,Part Time,18/1/2019,22/1/2019,29/5/2020,8,Yes,"['information', 'communication', 'technologies']",https://springboardcourses.ie/details/6503
Higher Diploma in Science in Data Analytics (1 Year Full-time) - Face to Face - [ICT Skills Conversion] [January 2019] Group 2,National College of Ireland,Higher Diploma in Science in Data Analytics,60,Full Time,18/1/2019,21/1/2019,31/12/2019,8,Yes,"['information', 'communication', 'technologies']",https://springboardcourses.ie/details/6502
Higher Diploma in Science in Data Analytics (1 Year Full-time)  - Face to Face - [ICT Skills Conversion] [January 2019] Group 1 ,National College of Ireland,Higher Diploma in Science in Data Analytics,60,Full Time,18/1/2019,21/1/2019,31/12/2019,8,Yes,"['information', 'communication', 'technologies']",https://springboardcourses.ie/details/6501
Higher Diploma in Science in Computing (Software Development) - ONLINE -[2 Years Part-time] [January 2019],National College of Ireland,Higher Diploma in Science in Computing - Major Award from Quality Qualifications Ireland,60,Part Time,18/1/2019,21/1/2019,29/5/2020,8,Yes,"['information', 'communication', 'technologies']",https://springboardcourses.ie/details/6500
Higher Diploma in Science in Web Technologies (1 Year Full-time) - ONLINE - [ICT Skills Conversion] [January 2019],National College of Ireland,Higher Diploma in Science in Web Technologies,60,Full Time,18/1/2019,21/1/2019,31/12/2019,8,Yes,"['information', 'communication', 'technologies']",https://springboardcourses.ie/details/6499
Postgraduate Diploma in Cyber Security Face to Face Delivery [January 2019] ,National College of Ireland,Postgraduate Diploma in Science in Cybersecurity,60,Part Time,22/1/2019,22/1/2019,31/12/2019,9,Yes,"['information', 'communication', 'technologies']",https://springboardcourses.ie/details/6498
Higher National Certificate in Computing [Limerick],Griffith College,BTEC Higher National Certificate in Computing,60,Part Time,15/2/2019,15/2/2019,31/1/2020,6,Yes,"['information', 'communication', 'technologies']",https://springboardcourses.ie/details/6493
Certificate in Data Analytics for Business JANUARY 2019 INTAKE - GROUP 2,Dundalk Institute of Technology,Certificate in Data Analytics for Business,10,Part Time,29/11/2018,31/1/2019,31/5/2019,7,Yes,"['information', 'communication', 'technologies']",https://springboardcourses.ie/details/6492
Certificate in Data Protection (November 2018),"Institute of Technology, Carlow",NFQ Level 8 (10 credit module),10,Part Time,23/11/2018,23/11/2018,12/12/2018,8,Yes,['services'],https://springboardcourses.ie/details/6491
Certificate in Digital Marketing and Digital Media Management (JANUARY 2019 INTAKE),Dundalk Institute of Technology,Special Purpose Award,30,Part Time,1/1/2019,29/1/2019,31/1/2020,7,Yes,"['business', 'administration', 'law']",https://springboardcourses.ie/details/6487
Diploma in Restaurant Management,Waterford Institute of Technology,Diploma in Restaurant Management,70,Part Time,15/9/2018,17/9/2018,30/8/2019,7,No,['services'],https://springboardcourses.ie/details/6482
Master of Science in Supply Chain Management - WICKLOW CAMPUS,"Institute of Technology, Carlow",NFQ Level 9,90,Part Time,10/9/2018,11/9/2018,21/9/2019,9,Yes,"['engineering', 'manufacturing', 'construction']",https://springboardcourses.ie/details/6481
Marketing Management (Specialist Diploma) (Blended Learning) [January 2019],University of Limerick,Minor,42,Part Time,21/12/2018,26/1/2019,21/12/2019,9,Yes,"['business', 'administration', 'law']",https://springboardcourses.ie/details/6470
Regulatory Affairs in (Bio)Pharmaceuticals (Specialist Diploma) [March 2019],University of Limerick,Minor,42,Part Time,16/11/2018,9/3/2019,21/12/2019,9,Yes,"['engineering', 'manufacturing', 'construction']",https://springboardcourses.ie/details/6469
Embedded Systems Engineering (Specialist Diploma) (Blended Learning) [January 2019],University of Limerick,Minor,36,Part Time,7/1/2019,23/1/2019,21/12/2019,9,Yes,"['information', 'communication', 'technologies']",https://springboardcourses.ie/details/6467
Certificate in Data Analytics for Business JANUARY 2019 INTAKE,Dundalk Institute of Technology,Certificate in Data Analytics for Business,10,Part Time,1/1/2019,30/1/2019,31/5/2019,7,Yes,"['information', 'communication', 'technologies']",https://springboardcourses.ie/details/6393
Certificate in Sound Design and Implementation for Interactive Media JANUARY 2019 INTAKE,Dundalk Institute of Technology,Certificate in Sound Design and Implementation for Interactive Media,40,Part Time,8/3/2019,8/3/2019,31/1/2020,7,Yes,"['arts', 'humanities']",https://springboardcourses.ie/details/6392
Certificate in Applied Electrical Engineering JANUARY 2019 INTAKE,Dundalk Institute of Technology,Certificate in Applied Electrical Engineering,30,Part Time,13/1/2019,22/1/2019,31/1/2020,6,Yes,"['engineering', 'manufacturing', 'construction']",https://springboardcourses.ie/details/6391
Higher Diploma in 3D Computer Animation [2 Years Part-time] JANUARY 2019 INTAKE,Dundalk Institute of Technology,Higher Diploma in Science in 3D Computer Animation,75,Part Time,30/1/2019,31/1/2019,29/1/2021,8,Yes,"['information', 'communication', 'technologies']",https://springboardcourses.ie/details/6390
Higher Diploma in Supply Chain Management - WICKLOW CAMPUS,"Institute of Technology, Carlow",NFQ Level 8,60,Part Time,10/9/2018,10/9/2018,30/6/2019,8,Yes,"['engineering', 'manufacturing', 'construction']",https://springboardcourses.ie/details/6376
Higher Diploma in Business in Tourism Marketing - WEXFORD CAMPUS,"Institute of Technology, Carlow",NFQ Level 8,60,Part Time,10/9/2018,10/9/2018,30/6/2019,8,Yes,['services'],https://springboardcourses.ie/details/6375
Higher Diploma in Business in Tourism Marketing - WICKLOW CAMPUS,"Institute of Technology, Carlow",NFQ Level 8,60,Part Time,10/9/2018,10/9/2018,30/6/2019,8,Yes,['services'],https://springboardcourses.ie/details/6370
Higher Diploma in Arts in Digital Media Design - WEXFORD CAMPUS,"Institute of Technology, Carlow",NFQ Level 8,60,Part Time,14/9/2018,17/9/2018,30/6/2019,8,Yes,"['arts', 'humanities']",https://springboardcourses.ie/details/6367
Higher Diploma in Arts in Digital Media Design - WICKLOW CAMPUS,"Institute of Technology, Carlow",NFQ Level 8,60,Part Time,10/9/2018,10/9/2018,30/6/2019,8,Yes,"['arts', 'humanities']",https://springboardcourses.ie/details/6366
Certificate in Data Protection WEXFORD CAMPUS,"Institute of Technology, Carlow",NFQ Level 8 (10 credit module),10,Part Time,5/10/2018,10/10/2018,30/6/2019,8,Yes,['services'],https://springboardcourses.ie/details/6363
Certificate in Data Protection - WICKLOW CAMPUS,"Institute of Technology, Carlow",NFQ Level 8 (10 credit module),10,Part Time,8/9/2018,10/9/2018,30/6/2019,8,Yes,['services'],https://springboardcourses.ie/details/6362
Certificate in Introduction to CAD & 3D Modelling - WEXFORD CAMPUS,"Institute of Technology, Carlow",NFQ Level 6 (10 credit module),10,Part Time,10/9/2018,10/9/2018,30/6/2019,6,Yes,"['engineering', 'manufacturing', 'construction']",https://springboardcourses.ie/details/6361
Postgraduate Diploma in Digital Marketing [January 2019],Waterford Institute of Technology,Major,60,Part Time,31/1/2019,31/1/2019,20/12/2019,9,Yes,"['business', 'administration', 'law']",https://springboardcourses.ie/details/6349
Masters of Science in Global Financial Information Systems,Waterford Institute of Technology,Major ,90,Part Time,8/8/2018,10/9/2018,30/8/2019,9,Yes,"['business', 'administration', 'law']",https://springboardcourses.ie/details/6348
Higher Diploma in Business Systems Analysis ,Waterford Institute of Technology,Higher Diploma Level 8,60,Part Time,5/9/2018,10/9/2018,30/8/2019,8,Yes,"['information', 'communication', 'technologies']",https://springboardcourses.ie/details/6347
Diploma in Supervisory Practice,Waterford Institute of Technology,Special Purpose,60,Part Time,4/9/2018,10/9/2018,10/5/2019,7,Yes,"['business', 'administration', 'law']",https://springboardcourses.ie/details/6346
Certificate in Pharmaceutical Technology,Waterford Institute of Technology,Certificate in Pharmaceutical Technology,60,Part Time,6/9/2018,10/9/2018,23/8/2019,6,Yes,"['natural', 'sciences', 'mathematics', 'statistics']",https://springboardcourses.ie/details/6345
Certificate in Fire Engineering,Waterford Institute of Technology,Minor ,30,Part Time,17/9/2018,2/10/2018,30/8/2019,7,Yes,"['engineering', 'manufacturing', 'construction']",https://springboardcourses.ie/details/6344
Certificate in Economics and Finance,Waterford Institute of Technology,Minor ,30,Part Time,5/9/2018,10/9/2018,20/5/2019,9,Yes,"['business', 'administration', 'law']",https://springboardcourses.ie/details/6343
Certificate in Data Protection and GDPR Practice [September 2018],Waterford Institute of Technology,Special Purpose ,10,Part Time,24/8/2018,17/9/2018,26/11/2018,6,Yes,"['business', 'administration', 'law']",https://springboardcourses.ie/details/6341
Certificate in Biomedical Engineering,Waterford Institute of Technology,Minor ,30,Part Time,18/1/2019,18/1/2019,20/12/2019,9,Yes,"['engineering', 'manufacturing', 'construction']",https://springboardcourses.ie/details/6340
BSc in Construction Site Management,Waterford Institute of Technology,BSc in Construction Site Management,60,Part Time,28/9/2018,4/10/2018,30/8/2019,7,Yes,"['engineering', 'manufacturing', 'construction']",https://springboardcourses.ie/details/6339
Higher Diploma in Computer Science [January 2019][2 Years Part-time],Waterford Institute of Technology,Higher Diploma Level 8,90,Part Time,14/1/2019,14/1/2019,18/12/2020,8,Yes,"['information', 'communication', 'technologies']",https://springboardcourses.ie/details/6338
Higher Diploma in Business Systems Analysis [2-year part-time][2 Years Part-time],Waterford Institute of Technology,Higher Diploma Level 8,60,Part Time,12/9/2018,14/9/2018,28/8/2020,8,Yes,"['information', 'communication', 'technologies']",https://springboardcourses.ie/details/6337
Higher Diploma in Agri-Food ICT Systems [January 2019][2 Years Part-time],Waterford Institute of Technology,Higher Diploma Level 8,60,Part Time,7/1/2019,14/1/2019,18/12/2020,8,Yes,"['information', 'communication', 'technologies']",https://springboardcourses.ie/details/6336
Supply Chain Management (Certificate) (Blended Learning - September 2018),University of Limerick,Minor,54,Part Time,17/7/2018,8/9/2018,13/5/2019,7,Yes,"['engineering', 'manufacturing', 'construction']",https://springboardcourses.ie/details/6334
Six Sigma (Specialist Diploma) (Distance Education) [January 2019],University of Limerick,Minor,36,Part Time,20/12/2018,19/1/2019,21/12/2019,9,Yes,"['engineering', 'manufacturing', 'construction']",https://springboardcourses.ie/details/6332
Six Sigma (Specialist Diploma) (Distance Education) [September 2018],University of Limerick,Minor,36,Part Time,23/8/2018,8/9/2018,11/5/2019,9,Yes,"['engineering', 'manufacturing', 'construction']",https://springboardcourses.ie/details/6331
Management Practice (Specialist Diploma) (Blended Learning),University of Limerick,Minor,42,Part Time,27/9/2018,27/9/2018,13/5/2019,9,Yes,"['business', 'administration', 'law']",https://springboardcourses.ie/details/6328
Management  (Certificate) (Blended Learning - September 2018),University of Limerick,Minor,54,Part Time,15/7/2018,8/9/2018,10/5/2019,6,Yes,"['business', 'administration', 'law']",https://springboardcourses.ie/details/6326
Lean Systems (Specialist Diploma) (Distance Education) [January 2019],University of Limerick,Minor,36,Part Time,20/12/2018,19/1/2019,21/12/2019,9,Yes,"['engineering', 'manufacturing', 'construction']",https://springboardcourses.ie/details/6325
Lean Systems (Specialist Diploma) (Distance Education) [September 2018],University of Limerick,Minor,36,Part Time,14/9/2018,14/9/2018,10/5/2019,9,Yes,"['engineering', 'manufacturing', 'construction']",https://springboardcourses.ie/details/6324
Information and Network Security (Specialist Diploma) (Blended Learning),University of Limerick,Minor Award from the University of Limerick,36,Part Time,4/9/2018,13/9/2018,30/6/2019,9,Yes,"['information', 'communication', 'technologies']",https://springboardcourses.ie/details/6323
Higher Diploma Computer Science [1 year Full-time],University College Dublin,Higher Diploma,75,Full Time,7/9/2018,10/9/2018,30/8/2019,8,Yes,"['information', 'communication', 'technologies']",https://springboardcourses.ie/details/6309
Postgraduate Certificate in Project Management,University College Cork,Postgraduate Certificate (Minor Award),30,Part Time,24/8/2018,14/9/2018,31/5/2019,9,Yes,"['business', 'administration', 'law']",https://springboardcourses.ie/details/6308
Postgraduate Certificate in (Bio)Pharma Processing,University College Cork,Postgraduate Certificate (Minor Award),30,Part Time,22/8/2018,21/9/2018,16/8/2019,9,Yes,"['natural', 'sciences', 'mathematics', 'statistics']",https://springboardcourses.ie/details/6307
MA in Digital Arts and Humanities,University College Cork,MA (Major Award),90,Part Time,24/8/2018,11/9/2018,2/9/2019,9,Yes,"['information', 'communication', 'technologies']",https://springboardcourses.ie/details/6306
Higher Diploma in Advanced Languages and Global Communication,University College Cork,Higher Diploma (Major Award),60,Part Time,1/9/2018,3/9/2018,30/8/2019,8,Yes,"['arts', 'humanities']",https://springboardcourses.ie/details/6305
Certificate in Procurement Management,University College Cork,Certificate (Special Purpose Award),30,Part Time,6/9/2018,14/9/2018,31/5/2019,8,Yes,"['business', 'administration', 'law']",https://springboardcourses.ie/details/6304
Certificate in Process and Chemical Engineering,University College Cork,Certificate (Minor Award),30,Part Time,3/9/2018,3/9/2018,7/5/2019,7,Yes,"['engineering', 'manufacturing', 'construction']",https://springboardcourses.ie/details/6303
Certificate in Operator Development (Pharma Manufacturing),University College Cork,Certificate (Special Purpose Award),30,Part Time,22/8/2018,9/2018,8/2019,7,Yes,"['engineering', 'manufacturing', 'construction']",https://springboardcourses.ie/details/6302
Certificate in Management Practice,University College Cork,Certificate (Special Purpose Award),30,Part Time,24/8/2018,15/9/2018,25/6/2019,7,Yes,"['business', 'administration', 'law']",https://springboardcourses.ie/details/6301
Postgraduate Certificate in Innovation and Enterprise Development (Dublin),Trinity College Dublin,Postgraduate Certificate,30,Part Time,15/3/2019,25/3/2019,9/8/2019,9,Yes,"['business', 'administration', 'law']",https://springboardcourses.ie/details/6298
Leadership & Management Development for Creative Business Owners [September 2018],The Entrepreneurs Academy,QQI Level 6 Business Planning,15,Part Time,15/9/2018,15/9/2018,30/1/2019,6,Yes,"['business', 'administration', 'law']",https://springboardcourses.ie/details/6293
Animation [Dublin] [January 2019],Pulse College,Level 6 QQI Certificate in Animation,60,Part Time,11/1/2019,14/1/2019,7/8/2019,6,Yes,"['arts', 'humanities']",https://springboardcourses.ie/details/6292
Animation [Dublin] [September 2018],Pulse College,Level 6 Minor Award in Animation,60,Part Time,10/9/2018,17/9/2018,1/5/2019,6,Yes,"['arts', 'humanities']",https://springboardcourses.ie/details/6290
Specialist Diploma in Medical Device Science (2018),"National University of Ireland, Galway",Specialist Diploma (minor award degree level 8),30,Part Time,18/8/2018,8/9/2018,31/5/2019,8,Yes,"['generic', 'programmes', 'qualifications']",https://springboardcourses.ie/details/6279
Specialist Diploma in Lean & Quality Systems (2018),"National University of Ireland, Galway",Specialist Diploma (minor award degree level 8),30,Part Time,17/8/2018,15/9/2018,31/5/2019,8,Yes,"['generic', 'programmes', 'qualifications']",https://springboardcourses.ie/details/6278
Postgraduate Diploma in Technology Commercialisation,"National University of Ireland, Galway",Postgraduate Diploma in Technology Commercialisation,40,Part Time,27/8/2018,1/9/2018,31/8/2019,9,Yes,"['business', 'administration', 'law']",https://springboardcourses.ie/details/6277
Postgraduate Diploma in Innovation Management,"National University of Ireland, Galway",Postgraduate Diploma in Innovation Management,40,Part Time,6/8/2018,1/9/2018,31/8/2019,9,Yes,"['business', 'administration', 'law']",https://springboardcourses.ie/details/6276
MSc in AgInnovation,"National University of Ireland, Galway",MSc in AgInnovation,90,Part Time,14/9/2018,1/9/2018,31/8/2019,9,Yes,"['agriculture', 'forestry', 'fisheries', 'veterinary']",https://springboardcourses.ie/details/6275
Higher Diploma in Applied Science (Software Design and Development- Industry Stream)[1 year Full-time],"National University of Ireland, Galway",Higher Diploma,60,Full Time,1/8/2018,10/9/2018,31/8/2019,8,Yes,"['information', 'communication', 'technologies']",https://springboardcourses.ie/details/6274
Post Graduate Diploma in Data Analytics Face to Face Delivery [January 2019],National College of Ireland,Postgraduate Diploma in Science in Data Analytics,60,Part Time,18/1/2019,22/1/2019,31/12/2019,9,Yes,"['information', 'communication', 'technologies']",https://springboardcourses.ie/details/6271
Higher Diploma in Science (Software Development)[1 year Full-time],Maynooth University,Higher Diploma in Science (Software Development),60,Full Time,21/9/2018,21/9/2018,31/5/2019,8,Yes,"['information', 'communication', 'technologies']",https://springboardcourses.ie/details/6263
Higher Diploma in Data Analytics [1 year Full-time],Maynooth University,HDip Data Science,60,Full Time,27/8/2018,3/9/2018,31/5/2019,8,Yes,"['information', 'communication', 'technologies']",https://springboardcourses.ie/details/6262
Higher Diploma in Arts in Food Management and Innovation ,Limerick Institute of Technology,Higher Diploma in Food Management and Innovation ,60,Part Time,7/12/2018,4/2/2019,30/12/2019,8,Yes,"['business', 'administration', 'law']",https://springboardcourses.ie/details/6261
Certificate in Near Zero Energy Buildings,Limerick Institute of Technology,"Certificate in Near Zero Energy Buildings (Special Purpose Award, Level 6, 20 Credits)",20,Part Time,12/11/2018,1/10/2018,24/5/2019,6,Yes,"['engineering', 'manufacturing', 'construction']",https://springboardcourses.ie/details/6258
Certificate in Aircraft Technical Services ,Limerick Institute of Technology,"Special Purpose Award, Level 7, 30 Credits",30,Part Time,1/9/2018,9/2018,6/2019,7,Yes,"['engineering', 'manufacturing', 'construction']",https://springboardcourses.ie/details/6257
